[
  {
    "aliases": [],
    "description": "A vertically stacked set of interactive headings that each reveal a section of content; FAQs / progressive disclosure. type=\"single|multiple\"; AccordionItem/Trigger/Content.",
    "exports": [
      "Accordion",
      "AccordionContent",
      "AccordionItem",
      "AccordionTrigger"
    ],
    "file": "components/accordion.json",
    "keywords": [],
    "name": "accordion",
    "title": "Accordion"
  },
  {
    "aliases": [],
    "description": "A modal dialog that interrupts the user with important content and expects a response; destructive/irreversible confirmations. AlertDialog + …Content/Overlay/Trigger/Close.",
    "exports": [
      "AlertDialog",
      "AlertDialogClose",
      "AlertDialogCancel",
      "AlertDialogContent",
      "AlertDialogDescription",
      "AlertDialogOverlay",
      "AlertDialogPortal",
      "AlertDialogTrigger"
    ],
    "file": "components/alert-dialog.json",
    "keywords": [],
    "name": "alert-dialog",
    "title": "Alert Dialog"
  },
  {
    "aliases": [
      "banner",
      "callout",
      "inline message",
      "notice"
    ],
    "description": "displays a callout for user attention; inline, non-blocking messages (info, success, warning, error)",
    "exports": [
      "Alert",
      "AlertTitle",
      "AlertDescription"
    ],
    "file": "components/alert.json",
    "keywords": [
      "error",
      "info",
      "neutral",
      "notification",
      "success",
      "warning"
    ],
    "name": "alert",
    "title": "Alert"
  },
  {
    "aliases": [],
    "description": "An image element with a fallback for representing the user. size. Stack → avatar-stack.tsx ( 605:6567).",
    "exports": [
      "AvatarStack",
      "Avatar"
    ],
    "file": "components/avatar-stack.json",
    "keywords": [],
    "name": "avatar-stack",
    "title": "Avatar Stack"
  },
  {
    "aliases": [],
    "description": "An image element with a fallback for representing the user. size. Stack → avatar-stack.tsx ( 605:6567).",
    "exports": [
      "Avatar",
      "AvatarStack"
    ],
    "file": "components/avatar.json",
    "keywords": [],
    "name": "avatar",
    "title": "Avatar"
  },
  {
    "aliases": [
      "chip",
      "label badge",
      "pill",
      "status badge",
      "tag"
    ],
    "description": "displays a badge or a component that looks like a badge; label/categorize items or show counts/status",
    "exports": [
      "Badge"
    ],
    "file": "components/badge.json",
    "keywords": [
      "category",
      "count",
      "indicator",
      "label",
      "status"
    ],
    "name": "badge",
    "title": "Badge"
  },
  {
    "aliases": [],
    "description": "Displays the path to the current resource using a hierarchy of links; navigation context in deep pages. Breadcrumb/List/Item/Link/Page/Separator/Ellipsis.",
    "exports": [
      "Breadcrumb",
      "BreadcrumbList",
      "BreadcrumbItem",
      "BreadcrumbLink",
      "BreadcrumbPage",
      "BreadcrumbSeparator",
      "BreadcrumbEllipsis"
    ],
    "file": "components/breadcrumb.json",
    "keywords": [],
    "name": "breadcrumb",
    "title": "Breadcrumb"
  },
  {
    "aliases": [],
    "description": "A joined row of buttons that share borders; grouped related actions. orientation.",
    "exports": [
      "ButtonGroup",
      "ButtonGroupSeparator",
      "ButtonGroupText"
    ],
    "file": "components/button-group.json",
    "keywords": [],
    "name": "button-group",
    "title": "Button Group"
  },
  {
    "aliases": [
      "action button",
      "btn",
      "cta",
      "icon button",
      "outline button",
      "primary button",
      "submit button"
    ],
    "description": "displays a button or a component that looks like a button; primary actions, form submits, dialog/menu triggers",
    "exports": [
      "Button"
    ],
    "file": "components/button.json",
    "keywords": [
      "action",
      "click",
      "destructive",
      "ghost",
      "icon-only",
      "submit",
      "tonal"
    ],
    "name": "button",
    "title": "Button"
  },
  {
    "aliases": [],
    "description": "A date field component that allows users to select dates; standalone or inside date-picker. react-day-picker; calendar/header, /day compose.",
    "exports": [
      "Calendar",
      "CalendarDayButton"
    ],
    "file": "components/calendar.json",
    "keywords": [],
    "name": "calendar",
    "title": "Calendar"
  },
  {
    "aliases": [
      "content card",
      "panel",
      "surface",
      "tile"
    ],
    "description": "displays a card with header, content, and footer; group related content and actions into a surface",
    "exports": [
      "Card",
      "CardHeader",
      "CardFooter",
      "CardTitle",
      "CardAction",
      "CardDescription",
      "CardContent"
    ],
    "file": "components/card.json",
    "keywords": [
      "container",
      "footer",
      "group",
      "header",
      "section"
    ],
    "name": "card",
    "title": "Card"
  },
  {
    "aliases": [],
    "description": "A carousel with motion and swipe built using Embla; browse a set of images/cards. orientation. With-image variant 950:4542.",
    "exports": [
      "Carousel",
      "CarouselContent",
      "CarouselItem",
      "CarouselPrevious",
      "CarouselNext"
    ],
    "file": "components/carousel.json",
    "keywords": [],
    "name": "carousel",
    "title": "Carousel"
  },
  {
    "aliases": [],
    "description": "A labeled checkbox control; when the checkbox needs an inline label/description. variant + size. Group: 1085:8757.",
    "exports": [
      "CheckboxButton",
      "CheckboxButtonGroup"
    ],
    "file": "components/checkbox-button.json",
    "keywords": [],
    "name": "checkbox-button",
    "title": "Checkbox Button"
  },
  {
    "aliases": [
      "check",
      "check box",
      "tick box"
    ],
    "description": "a control that toggles between checked and not checked; opt-in/agree or multi-select lists",
    "exports": [
      "Checkbox"
    ],
    "file": "components/checkbox.json",
    "keywords": [
      "agree",
      "form",
      "indeterminate",
      "multi-select",
      "opt-in"
    ],
    "name": "checkbox",
    "title": "Checkbox"
  },
  {
    "aliases": [
      "autocomplete",
      "multi-select",
      "searchable select",
      "typeahead"
    ],
    "description": "Autocomplete input with a list of suggestions (popover + command); searchable single-select over many options. size. (Figma \"Select\" set on dropdown-menu page — Part 4.)",
    "exports": [
      "Combobox",
      "ComboboxLabel",
      "ComboboxCollection",
      "ComboboxTrigger",
      "ComboboxValue",
      "ComboboxClear",
      "ComboboxChips",
      "ComboboxChip",
      "ComboboxChipsInput",
      "ComboboxInput",
      "ComboboxContent",
      "ComboboxList",
      "ComboboxItem",
      "ComboboxEmpty",
      "ComboboxGroup",
      "ComboboxGroupLabel",
      "ComboboxSeparator",
      "ComboboxField"
    ],
    "file": "components/combobox.json",
    "keywords": [
      "async options",
      "chips",
      "filter",
      "search",
      "suggestions"
    ],
    "name": "combobox",
    "title": "Combobox"
  },
  {
    "aliases": [],
    "description": "Fast, composable command menu; command palettes and quick search/launchers. Command/Input/List/Empty/Group/Item/Shortcut. Focused composition.",
    "exports": [
      "Command",
      "CommandDialog",
      "CommandInput",
      "CommandList",
      "CommandEmpty",
      "CommandGroup",
      "CommandGroupLabel",
      "CommandItem",
      "CommandSeparator",
      "CommandShortcut"
    ],
    "file": "components/command.json",
    "keywords": [],
    "name": "command",
    "title": "Command"
  },
  {
    "aliases": [],
    "description": "Displays a menu of actions triggered by a right click; contextual actions on an item/row. Full surface; Label is a plain styled div.",
    "exports": [
      "ContextMenu",
      "ContextMenuTrigger",
      "ContextMenuPortal",
      "ContextMenuContent",
      "ContextMenuGroup",
      "ContextMenuItem",
      "ContextMenuCheckboxItem",
      "ContextMenuRadioGroup",
      "ContextMenuRadioItem",
      "ContextMenuLabel",
      "ContextMenuSeparator",
      "ContextMenuShortcut",
      "ContextMenuSub",
      "ContextMenuSubTrigger",
      "ContextMenuSubContent"
    ],
    "file": "components/context-menu.json",
    "keywords": [],
    "name": "context-menu",
    "title": "Context Menu"
  },
  {
    "aliases": [],
    "description": "Composed data table. Also data-table-header.tsx, data-table-cell.tsx.",
    "exports": [
      "DataTableCell"
    ],
    "file": "components/data-table-cell.json",
    "keywords": [],
    "name": "data-table-cell",
    "title": "Data Table Cell"
  },
  {
    "aliases": [],
    "description": "Composed data table. Also data-table-header.tsx, data-table-cell.tsx.",
    "exports": [
      "SortingIcons",
      "TableHeaderDecoration",
      "TableHeader",
      "TableHeaderRow"
    ],
    "file": "components/data-table-header.json",
    "keywords": [],
    "name": "data-table-header",
    "title": "Data Table Header"
  },
  {
    "aliases": [],
    "description": "Composed data table. Also data-table-header.tsx, data-table-cell.tsx.",
    "exports": [
      "TableTitle",
      "TableRow",
      "DataTable"
    ],
    "file": "components/data-table.json",
    "keywords": [],
    "name": "data-table",
    "title": "Data Table"
  },
  {
    "aliases": [],
    "description": "A date picker component; pick a single date or range in forms. Composes calendar + popover + button.",
    "exports": [
      "DatePicker",
      "DatePickerField"
    ],
    "file": "components/date-picker.json",
    "keywords": [],
    "name": "date-picker",
    "title": "Date Picker"
  },
  {
    "aliases": [
      "modal",
      "modal dialog",
      "popup window"
    ],